{
  "act_id": "act_setup",
  "title": "The Archer's Challenge",
  "viz_panel": "svg",
  "beats": [
    {
      "say": "An archer draws back her bow, aiming 30 degrees above horizontal. The arrow will leave with an initial speed of 40 meters per second. The question is: how far will it travel before hitting the ground?",
      "card": {
        "type": "title",
        "heading": "The Archer's Challenge",
        "subheading": "Projectile Motion Problem"
      },
      "viz_actions": [
        {
          "method": "createArcher",
          "params": {
            "position": "origin",
            "bowAngle": 30
          },
          "offset": 0
        },
        {
          "method": "drawInitialVelocity",
          "params": {
            "magnitude": 40,
            "angle": 30,
            "color": "#f59e0b"
          },
          "offset": "+1.0"
        }
      ]
    },
    {
      "say": "At first glance, this seems incredibly complex. The arrow will curve gracefully through space while gravity pulls it downward and its forward motion continues. How do we even begin to solve this?",
      "card": {
        "type": "text",
        "content": "Initial conditions:\n• Launch angle: 30°\n• Initial speed: 40 m/s\n• Gravity: 9.8 m/s²"
      },
      "viz_actions": [
        {
          "method": "launchArrow",
          "params": {
            "v0x": 34.64,
            "v0y": 20,
            "gravity": 9.8
          },
          "offset": "+0.5"
        },
        {
          "method": "drawTrajectoryPath",
          "params": {
            "color": "#818cf8",
            "opacity": 0.7,
            "realTime": true
          },
          "offset": "+1.5"
        }
      ]
    }
  ]
}