{
  "act_id": "act_find_min_k",
  "title": "Finding Minimum k",
  "viz_panel": "svg",
  "beats": [
    {
      "say": "To determine the least number of circles needed, we want to find the minimum $k$ such that the total shaded area reaches at least $2023\\pi$. This means we need to solve for the equation of the shaded area.",
      "card": null,
      "viz_actions": [
        {
          "method": "drawGraph",
          "params": {
            "equation": "k(k + 1)"
          },
          "offset": 0
        }
      ],
      "inline_viz": null
    },
    {
      "say": "Now, let's graph the equation and see where it intersects with our threshold line at $4046$. This will show us the minimum $k$ needed to achieve the shaded area requirement.",
      "card": null,
      "viz_actions": [
        {
          "method": "highlightIntersection",
          "params": {
            "x": 4046
          },
          "offset": 0
        }
      ],
      "inline_viz": null
    }
  ]
}