{
  "act_id": "act_decomposition",
  "title": "Splitting the Motion: Two Simple Problems in Disguise",
  "viz_panel": "svg",
  "beats": [
    {
      "say": "Here's the key insight physicists use to crack projectile motion: horizontal and vertical don't talk to each other. Gravity only pulls down — it never touches the horizontal speed. That means we can separate them completely.",
      "card": {
        "type": "text",
        "content": "**Independence of motion:** Horizontal and vertical components evolve independently. Gravity acts only on the vertical axis."
      },
      "viz_actions": [
        {
          "method": "highlightLaunchArrow",
          "params": {},
          "offset": "0"
        }
      ],
      "inline_viz": null,
      "duration": null
    },
    {
      "say": "Watch the single launch arrow split into two. The blue arrow goes right — that's the horizontal component. The red arrow goes straight up — that's the vertical. Together, they form a perfect rectangle, and the original arrow is exactly their diagonal sum.",
      "card": null,
      "viz_actions": [
        {
          "method": "splitArrowIntoComponents",
          "params": {
            "angle": 45,
            "v0": 20,
            "scale": 1
          },
          "offset": "0"
        }
      ],
      "inline_viz": null,
      "duration": null
    },
    {
      "say": "At $45°$, cosine and sine are both $\\frac{\\sqrt{2}}{2}$, so each component is $v_0 \\cdot \\frac{\\sqrt{2}}{2} = 10\\sqrt{2} \\approx 14.14$ m/s. A perfectly equal split — and as you'll see later, that symmetry is exactly why $45°$ gives maximum range.",
      "card": {
        "type": "derivation",
        "title": "Component Decomposition at 45°",
        "steps": [
          {
            "latex": "v_{0x} = v_0 \\cos 45° = 20 \\cdot \\frac{\\sqrt{2}}{2} = 10\\sqrt{2} \\approx 14.14 \\text{ m/s}"
          },
          {
            "latex": "v_{0y} = v_0 \\sin 45° = 20 \\cdot \\frac{\\sqrt{2}}{2} = 10\\sqrt{2} \\approx 14.14 \\text{ m/s}",
            "highlight": true
          },
          {
            "latex": "v_{0x} = v_{0y} \\quad \\text{(unique to } 45°\\text{)}"
          }
        ]
      },
      "viz_actions": [
        {
          "method": "labelComponents",
          "params": {
            "vx_label": "10√2 m/s",
            "vy_label": "10√2 m/s"
          },
          "offset": "0"
        },
        {
          "method": "showComponentEquations",
          "params": {
            "step": "decompose"
          },
          "offset": "+1.2"
        }
      ],
      "inline_viz": null,
      "duration": null
    },
    {
      "say": "Now let's pull them fully apart. A dividing line splits the screen. On the left, the full 2D parabola stays — dimmed but intact. On the right, two separate tracks appear, one for each component.",
      "card": null,
      "viz_actions": [
        {
          "method": "splitScreen",
          "params": {},
          "offset": "0"
        }
      ],
      "inline_viz": null,
      "duration": null
    },
    {
      "say": "Look at the top-right strip — the horizontal track. The dot glides right at perfectly constant speed. Notice those equally spaced tick marks: equal distances in equal times. No force, no acceleration. Just steady, unwavering motion.",
      "card": null,
      "viz_actions": [
        {
          "method": "animateHorizontalStrip",
          "params": {},
          "offset": "0"
        }
      ],
      "inline_viz": null,
      "duration": null
    },
    {
      "say": "Now the vertical strip. The dot rises, decelerates, hangs for a moment at the peak, then falls back down — exactly like a ball tossed straight up. This is just gravity doing its simple, one-dimensional work.",
      "card": null,
      "viz_actions": [
        {
          "method": "animateVerticalStrip",
          "params": {},
          "offset": "0"
        }
      ],
      "inline_viz": null,
      "duration": null
    },
    {
      "say": "Two simple problems, happening simultaneously. The intimidating parabola on the left is nothing more than these two motions running in parallel — a disguise hiding two very familiar ideas.",
      "card": {
        "type": "recap",
        "title": "The Disguise Revealed",
        "content": [
          {
            "type": "text",
            "value": "Projectile motion = two independent 1D problems:"
          },
          {
            "type": "latex",
            "value": "\\text{Horizontal: } x(t) = v_{0x}\\, t = 10\\sqrt{2}\\; t"
          },
          {
            "type": "latex",
            "value": "\\text{Vertical: } y(t) = v_{0y}\\, t - \\tfrac{1}{2}g t^2 = 10\\sqrt{2}\\; t - 4.9\\, t^2"
          },
          {
            "type": "text",
            "value": "Next: find how long the ball stays in the air using the vertical equation alone."
          }
        ],
        "figure": "<svg viewBox='0 0 320 120' xmlns='http://www.w3.org/2000/svg' font-family='sans-serif'><rect width='320' height='120' fill='transparent'/><rect x='10' y='10' width='135' height='100' rx='8' fill='#1e1b4b' stroke='#6366f1' stroke-width='1.5'/><text x='77' y='30' text-anchor='middle' fill='#818cf8' font-size='11' font-weight='bold'>HORIZONTAL</text><line x1='25' y1='75' x2='130' y2='75' stroke='#334155' stroke-width='1'/><circle cx='35' cy='75' r='5' fill='#60a5fa'/><circle cx='60' cy='75' r='5' fill='#60a5fa' opacity='0.7'/><circle cx='85' cy='75' r='5' fill='#60a5fa' opacity='0.5'/><circle cx='110' cy='75' r='5' fill='#60a5fa' opacity='0.3'/><text x='77' y='100' text-anchor='middle' fill='#94a3b8' font-size='9'>constant speed</text><rect x='175' y='10' width='135' height='100' rx='8' fill='#1e1b4b' stroke='#f59e0b' stroke-width='1.5'/><text x='242' y='30' text-anchor='middle' fill='#fbbf24' font-size='11' font-weight='bold'>VERTICAL</text><line x1='242' y1='85' x2='242' y2='35' stroke='#334155' stroke-width='1'/><circle cx='242' cy='85' r='5' fill='#f87171'/><circle cx='242' cy='65' r='5' fill='#f87171' opacity='0.7'/><circle cx='242' cy='50' r='5' fill='#f87171' opacity='0.5'/><circle cx='242' cy='42' r='5' fill='#f87171' opacity='0.3'/><text x='242' y='105' text-anchor='middle' fill='#94a3b8' font-size='9'>gravity decelerates</text></svg>"
      },
      "viz_actions": [
        {
          "method": "labelStrips",
          "params": {
            "horizontal_text": "Constant velocity — no force acts",
            "vertical_text": "Uniform acceleration — gravity only"
          },
          "offset": "0"
        }
      ],
      "inline_viz": "svg",
      "duration": null
    }
  ]
}