{
  "act_id": "act_wp_unit_circle",
  "title": "The Unit Circle at 45°: A Perfect Symmetry",
  "viz_panel": "figure",
  "beats": [
    {
      "say": "Here's what's really going on at 45°. Picture the unit circle — a circle of radius one centered at the origin. The point on that circle at 45° sits exactly halfway between the x-axis and the y-axis. Its x-coordinate and y-coordinate are identical.",
      "card": {
        "type": "figure",
        "svg": "<svg viewBox='0 0 320 320' xmlns='http://www.w3.org/2000/svg' style='background:transparent'><circle cx='160' cy='160' r='110' fill='none' stroke='#6366f1' stroke-width='2'/><line x1='40' y1='160' x2='280' y2='160' stroke='#ffffff' stroke-width='1' stroke-opacity='0.4'/><line x1='160' y1='40' x2='160' y2='280' stroke='#ffffff' stroke-width='1' stroke-opacity='0.4'/><line x1='160' y1='160' x2='237.8' y2='82.2' stroke='#f59e0b' stroke-width='2.5'/><line x1='237.8' y1='82.2' x2='237.8' y2='160' stroke='#818cf8' stroke-width='2' stroke-dasharray='5,4'/><line x1='160' y1='160' x2='237.8' y2='160' stroke='#34d399' stroke-width='2' stroke-dasharray='5,4'/><line x1='237.8' y1='160' x2='237.8' y2='82.2' stroke='none'/><rect x='230' y='153' width='7' height='7' fill='none' stroke='#ffffff' stroke-width='1.2' stroke-opacity='0.7'/><circle cx='237.8' cy='82.2' r='5' fill='#f59e0b'/><text x='249' y='78' fill='#f59e0b' font-size='13' font-family='serif' font-style='italic'>P</text><text x='195' y='175' fill='#34d399' font-size='13' font-family='serif'>cos 45°</text><text x='243' y='128' fill='#818cf8' font-size='13' font-family='serif'>sin 45°</text><path d='M 175 160 A 15 15 0 0 0 170.6 149.4' fill='none' stroke='#f59e0b' stroke-width='1.5'/><text x='176' y='152' fill='#f59e0b' font-size='11' font-family='sans-serif'>45°</text><text x='90' y='260' fill='#ffffff' font-size='12' font-family='sans-serif' fill-opacity='0.7'>cos 45° = sin 45° = √2/2</text></svg>",
        "caption": "At 45°, the point $P$ on the unit circle has equal $x$ and $y$ coordinates — so $\\cos 45° = \\sin 45°$."
      },
      "viz_actions": [],
      "inline_viz": null,
      "duration": null
    },
    {
      "say": "Why are they equal? The triangle formed is a 45-45-90 triangle — and since two of its angles are the same, the two legs must be the same length. Both legs equal $\\frac{\\sqrt{2}}{2}$. So $\\cos 45°$ and $\\sin 45°$ are not just close — they are exactly the same number.",
      "card": {
        "type": "derivation",
        "title": "45-45-90 Triangle",
        "steps": [
          {
            "latex": "\\text{Triangle legs: } a = b \\quad (\\text{isosceles})"
          },
          {
            "latex": "a^2 + b^2 = 1^2 \\implies 2a^2 = 1 \\implies a = \\tfrac{\\sqrt{2}}{2}"
          },
          {
            "latex": "\\cos 45° = \\tfrac{\\sqrt{2}}{2}, \\quad \\sin 45° = \\tfrac{\\sqrt{2}}{2}",
            "highlight": true
          }
        ]
      },
      "viz_actions": [],
      "inline_viz": null,
      "duration": null
    },
    {
      "say": "That makes the answer to our quiz question completely clear. The horizontal component is $v_0 \\cos 45° = v_0 \\cdot \\frac{\\sqrt{2}}{2}$, and the vertical component is $v_0 \\sin 45° = v_0 \\cdot \\frac{\\sqrt{2}}{2}$. They are always equal — no matter what $v_0$ is. 45° is the one angle where the ball splits its speed perfectly.",
      "card": {
        "type": "latex",
        "content": "v_{0x} = v_0 \\cos 45° = v_0 \\sin 45° = v_{0y} = \\frac{\\sqrt{2}}{2}\\,v_0",
        "highlight": true
      },
      "viz_actions": [],
      "inline_viz": "figure",
      "duration": null
    }
  ]
}